rank,description,similarity_score
1,"A fair bearded man standing in a room in white formal shirt, grey trousers and brown leather shoes holding a big grey dog in his arms.",0.335205078125
2,A tall man standing in a room holding a big dog in his arms.,0.3291015625
3,A man standing straight and holding a dog with both hands.,0.314453125
4,A big animal carried by a human being in a closed room.,0.294677734375
5,Two living beings in front of a bookcase in a white room,0.257080078125
6,A human showing empathy towards a fellow living creature by displaying care for it.,0.251953125
7,A dog in a lying position some distance above the ground.,0.2178955078125
8,A book case kept in front of a white wall being blocked by two living entities.,0.208251953125
9,A snake trying to attack an innocent child playing with her toys.,0.1759033203125
10,"A black cat is playing with a young boy in a sunlit park, surrounded by green trees and a clear blue sky.",0.140869140625
